,Evidence Type,Important Info,URL,Extra Info,Priority Score,Headline Sentiment
50,Corroboration,"Lindaikejiblog on Instagram: ""A Russian state TV has declared that World War 3 has begun following the sinking of the prized warship, Moskva.

The Kremlin’s main propaganda mouthpiece went off on a rant last night after the flagship of the Black Sea Fleet was taken out.

Olga Skabeyeva, one of Vladimir Putin’s leading propagandists, told viewers Western support for Ukraine amounted to direct conflict with Russia, saying: ‘What it’s escalated into can safely be called World War Three. That’s entirely for sure.

‘Now we’re definitely fighting against NATO

Military commentator Dmitry Drozdenko said on separate state-run Channel 1: 

“In actual fact a full-scale multi-level war is underway with the collective West.

“And the West has long been preparing for the war"".

Anchor Olesya Loseva, host of Vremya Pokazhet, told viewers that the West was now supplying ""zillions of weapons” to Ukraine. She claimed Ukraine was doing the West’s bidding by carrying out ""yet more provocations, bloody",https://www.instagram.com/p/CcYq-xVNS2h/,"12K likes, 1,676 comments - Lindaikejiblog (@lindaikejiblogofficial) on Instagram: ""A Russian state TV has declared that World War 3 has begun following the sinking of the prized ..."" Page Type: instapp:photo Published on: ",30,"neutral sentiment, score=0.4727492332458496"
51,Corroboration,"Noam Chomsky and Jeremy Scahill on the Russia-Ukraine War, the Media, Propaganda, and Accountability",https://www.youtube.com/watch?v=8Jr0PCU4m7M,"Renowned dissident and linguist Noam Chomsky joins The Intercept's Jeremy Scahill for a wide-ranging discussion on Russia’s invasion of Ukraine, holding the ... Page Type: video.other Published on: ",30,"neutral sentiment, score=0.7863419651985168"
52,Corroboration,Russia-Ukraine war live: Biden will send ‘message’ to Putin in war anniversary speech | WION Live,https://www.youtube.com/watch?v=3O611H4r96A,Russia requested a meeting of the United Nations Security Council to mark the eighth anniversary of the signing of the Minsk agreement. The 2015 agreement ou... Page Type: video.other Published on: ,30,"neutral sentiment, score=0.9073820114135742"
53,Corroboration,"U.S., EU envoys watch in silence as Putin scolds West in Kremlin speech | Russia-Ukraine War",https://www.youtube.com/watch?v=1M79sOFxAjc,"Russian President Vladimir Putin tore into the U.S., European Union and the West for the Ukraine crisis. In a meeting of the Kremlin's Security Council, Puti... Page Type: video.other Published on: ",30,"negative sentiment, score=0.536816418170929"
54,Corroboration,War in Ukraine: Veteran Russian diplomat reveals Kremlin's plan | Conflict Zone,https://www.youtube.com/watch?v=IyZhzpq2GdQ,Boris Bondarev was until May of 2022 a Russian diplomat working in the foreign ministry and posted to Moscow’s mission to the United Nations activities in Ge... Page Type: video.other Published on: ,30,"neutral sentiment, score=0.8769749999046326"
55,Corroboration,President Obama Addresses the United Nations General Assembly,https://www.flickr.com/photos/us_embassy_newzealand/15158609550,"United Nations General Assembly Hall   New York City, New York   10:13 A.M. EDT   PRESIDENT OBAMA:  Mr. President, Mr. Secretary General, fellow delegates, ladies and gentlemen:  We come together at a crossroads between war and peace; between disorder and integration; between fear and hope.   Around the globe, there are signposts of progress.  The shadow of World War that existed at the founding of this institution has been lifted, and the prospect of war between major powers reduced.  The ranks of member states has more than tripled, and more people live under governments they elected. Hundreds of millions of human beings have been freed from the prison of poverty, with the proportion of those living in extreme poverty cut in half.  And the world economy continues to strengthen after the worst financial crisis of our lives.    Today, whether you live in downtown Manhattan or in my grandmother’s village more than 200 miles from Nairobi, you can hold in your hand more information than the world’s greatest  Page Type: article Published on: ",30,"neutral sentiment, score=0.9368378520011902"
56,Corroboration,Ukraine Under Attack,https://www.flickr.com/photos/13476480@N07/51969350922,"Russian troops in Ukraine. New sanctions will target Russia’s military industrial sector.Credit...Sergei Ilnitsky/EPA, via Shutterstock  www-nytimes-com.translate.goog/live/2022/03/29/world/ukra...  ---------------  Alan Rappeport March 29, 2022, 2:37 p.m. ETMarch 29, 2022 March 29, 2022  Alan Rappeport The U.S. and allies are preparing new sanctions on Russian supply chains.   WASHINGTON — The United States is preparing new sanctions targeting the supply chains of Russia’s military industrial sector as it seeks to erode Moscow’s ability to attack Ukraine, Adewale Adeyemo, the deputy Treasury secretary, said on Tuesday.  The new sanctions will be rolled out in coordination with Western allies and come amid an ongoing effort to exert pressure on the Russian economy. Russia’s central bank, major financial institutions and defense companies have already been subjected to coordinated sanctions.  “We are planning to target additional sectors that are critical to the Kremlin’s ability to operate its w Page Type: article Published on: ",30,"neutral sentiment, score=0.5468081831932068"
57,Corroboration,War and Cheese,https://vimeo.com/170083208,"“I heard destiny calling… I was going to be a cheesemaker.” When Oleg Sirota discovered his native Russia was banning all Western cheese imports,… Page Type: video.other Published on: ",30,"neutral sentiment, score=0.9591792821884155"
58,Corroboration,"Serj Tankian on Instagram: ""While the world is busy with Ukraine the fascist petro oligarchic state of Azerbaijan continues its war crimes against Armenians Posted @withregram • @zartonkmedia Artsakh On High Alert As Azerbaijan Begins Firing 120mm Shells, Women & Children Evacuating From Certain Villages
➖➖➖
Azerbaijani Forces are currently firing 120mm mortar shells in the direction of Artsakh’s Karmir Shuka and Khnushinak villages in Martuni and Khramort in Askeran, per Zartonk Media’s sources in Artsakh.

Women and children are being evacuated from certain village in Artsakh.

Azerbaijan’s Army began using 120mm mortar shells compared to the 60mm shells during previous days.

Azerbaijan’s Army has been accumulating military equipment and manpower in the above mentioned areas.

There are no official statements yet.""",https://www.instagram.com/p/Ca73Mo-vx3W/,"11K likes, 249 comments - Serj Tankian (@serjtankian) on Instagram: ""While the world is busy with Ukraine the fascist petro oligarchic state of Azerbaijan continues i..."" Page Type: instapp:photo Published on: ",20,"neutral sentiment, score=0.49946466088294983"
59,Corroboration,"NPR on Instagram: ""Russian President Vladimir Putin announcing he was suspending Russia's participation in the last remaining arms control treaty with the U.S. The pact caps the number of strategic nuclear warheads that Russia and the U.S. can deploy. Since the two countries have the vast majority of all deployable warheads, the pact regulates the two largest nuclear arms arsenals in the world.⁠
⁠
Putin delivered his remarks as part of his annual state of the nation address, days ahead of the one-year anniversary of the Kremlin's full-scale invasion of Ukraine.⁠
⁠
Speaking to a joint session of the Russian parliament and Kremlin officials, Russian President Vladimir Putin presented the war in Ukraine as an existential struggle against the West.⁠
⁠
""They are the ones who started this war, and we are using our forces to put a stop to it,"" said Putin, referring to the conflict in Ukraine.⁠
⁠
Tap the link in our bio for more.""",https://www.instagram.com/p/Co7nHjgrILs/,"8,349 likes, 1,759 comments - NPR (@npr) on Instagram: ""Russian President Vladimir Putin announcing he was suspending Russia's participation in the last ..."" Page Type: instapp:photo Published on: ",20,"neutral sentiment, score=0.5484379529953003"
60,Corroboration,Putin's Attack on Ukraine: Documenting War Crimes (full documentary) | FRONTLINE,https://www.youtube.com/watch?v=PSFjGXKS59Q,"In a 90-minute special investigation, FRONTLINE and The Associated Press go inside Russia’s war on Ukraine and uncover harrowing evidence of potential war cr... Page Type: video.other Published on: ",20,"neutral sentiment, score=0.9165164828300476"
61,Corroboration,'I know the truth': CNN asks Russians what they think about Putin's war,https://www.youtube.com/watch?v=zD_d9j0Rod8,CNN's Nic Robertson reports that Russian state media is not showing the death and destruction from the war with Ukraine and is instead showing Russian soldie... Page Type: video.other Published on: ,20,"neutral sentiment, score=0.8543053865432739"
62,Corroboration,Putin's hidden war: the Russians fighting back,https://www.youtube.com/watch?v=_LJV5nOSjCE,The invasion of Ukraine left Russians with a stark choice: carry on as normal or make a stand against the war. But speaking out in Russia carries huge risks.... Page Type: video.other Published on: ,20,"neutral sentiment, score=0.8841609358787537"
63,Corroboration,Kremlin warns of escalation if West Gives Ukraine longer range weapons | Latest English News | WION,https://www.youtube.com/watch?v=zeb2-SRePiY,The Kremlin warned of an escalation in Ukraine if the West gives the pro-Western country more weapons capable of striking Russia. The warning comes on the ev... Page Type: video.other Published on: ,20,"neutral sentiment, score=0.620122492313385"
64,Corroboration,"Putin appoints new General to lead Ukraine war, Is Kremlin changing its strategy? | World News| WION",https://www.youtube.com/watch?v=n6V83BK2QWE,Weeks after Russia announced a change in its military strategy in Ukraine after which Russian troops withdrew from northern and western Ukraine and that Russ... Page Type: video.other Published on: ,20,"neutral sentiment, score=0.8911415934562683"
65,Corroboration,US warns of tougher sanctions against Russia over Ukraine - video Dailymotion,https://www.dailymotion.com/video/x1o4da9,"The United States says it will impose stricter sanctions on Russia if it continues to take action against Ukraine.  The threat of tougher penalties came from the US ambassador to the UN, Samantha Power in an interview on ABC’s This Week.  “The forces are doing in each six or seven cities that they have been activing exactly the same thing.  So certainly it bears the tell-tale signs of Moscow’s involvement. And if actions like the kind we’ve seen over the last few days continue, you’re going to see a ramping up of those sanctions.”  However, Russia’s Foreign Minister Sergei Lavrov said Kyiv was “demonstrating its inability to take responsibility for the fate of the country.”  Meanwhile, NATO Secretary General Anders Fogh Rasmussen has repeated his concern about similarities in some of the separatists’ appearance to that of Russian troops who seized control in Crimea.  It comes after he warned that Russia’s military manoeuvres on the Ukraine border risk stoking tensions. Page Type: video Published on: ",20,"negative sentiment, score=0.5717580914497375"
66,Corroboration,"Ukraine war: Russian winter offensive falling short of Kremlin’s goals, Rosgvardia admits - video Dailymotion",https://www.dailymotion.com/video/x8jq5ie,"Russian, Ukrainian, and Western sources appear to agree that Russia's winter offensive has failed to achieve the Kremlin’s goals of seizing the Donetsk and Luhansk region administrative borders by March 31. Page Type: video Published on: ",20,"neutral sentiment, score=0.49517592787742615"
67,Corroboration,Russia-Ukraine war: Kremlin says Ukraine ceasefire won't achieve their goals | Oneindia News - video Dailymotion,https://www.dailymotion.com/video/x8jo281,Russia: Kremlin spokesperson Dmitry Peskov says Ukraine ceasefire won't achieve our goals; Russia adopts new global strategy to curtail western 'dominance'; Satellite images show China's plan of helping Myanmar with an air base in Coco island; US: Destructive tornadoes rip through Little Rock in Arkansas and emergency declared.     #RussiaUkraineWar #DmitryPeskov #Kremlin                  ~PR.151~ED.103~GR.121~HT.95~ Page Type: video Published on: ,20,"neutral sentiment, score=0.6189609169960022"
68,Corroboration,"Putin Rages Against the West, Defends Ukraine Invasion in Annual State of the Nation Speech - video Dailymotion",https://www.dailymotion.com/video/x8ii2g0,"Russian President Vladimir Putin accused Western countries Tuesday of igniting and sustaining the war in Ukraine, dismissing any blame for Moscow almost a year after the Kremlin’s unprovoked invasion of its neighbor that has killed tens of thousands of people. Page Type: video Published on: ",10,"neutral sentiment, score=0.6029349565505981"
69,Corroboration,"Russia could use nuclear weapons if faced with ‘existential threat’, says Kremlin | Oneindia News - video Dailymotion",https://www.dailymotion.com/video/x89aru2,Kremlin spokesman Dmitry Peskov said that Russia would only use nuclear weapons in the Ukraine conflict if it were facing an ‘existential threat’.    #RussiaUkraineWar #RussiaNuclearWeapons #DmitryPeskov Page Type: video Published on: ,10,"neutral sentiment, score=0.6499650478363037"
