,Evidence Type,Important Info,URL,Extra Info,Priority Score,Headline Sentiment
0,sentiment-analysis-of-intelligence_statement,"negative sentiment, score: 0.6664755344390869",,,,
1,Corroboration,The Undeniable Street View | Hacker News,https://news.ycombinator.com/item?id=35312352,"Mar 26, 2023 ... If should be clear to see how the incentives of Ukrainians and Russians are polar opposite, yet they will both use truth as a weapon of war. Page Type:  Published on: ",220,"neutral sentiment, score=0.6300176382064819"
2,Corroboration,Namecheap: Russia Service Termination | Hacker News,https://news.ycombinator.com/item?id=30504812,"Feb 28, 2022 ... Unfortunately, due to the Russian regime's war crimes and human rights ... Putin will back down, or that Russian people will force him to. Page Type:  Published on: ",210,"neutral sentiment, score=0.7863560914993286"
3,Corroboration,Russian forces invade Ukraine after Putin orders attack | Hacker News,https://news.ycombinator.com/item?id=30450336,"Feb 24, 2022 ... “Ukraine, a new and important space on the Eurasian chessboard, is a geopolitical pivot because its very existence as an independent country ... Page Type:  Published on: ",210,"neutral sentiment, score=0.7818233966827393"
4,Corroboration,Open Letter to Noam Chomsky (and Other Intellectuals) on the ...,https://news.ycombinator.com/item?id=31457200,"Ukraine has been successful in slowing Russia down, but that's about it. ... to be but if it steps over the line, it will get its ass handled back to it. Page Type:  Published on: ",170,"neutral sentiment, score=0.8958057165145874"
5,Corroboration,On the Weaponisation of Open Source | Hacker News,https://news.ycombinator.com/item?id=30726098,"Mar 18, 2022 ... The fact that there has not been a strong push back confirms my ... is a war where the nation of Russia has decided to murder Ukrainians. Page Type:  Published on: ",170,"neutral sentiment, score=0.9240638017654419"
6,Corroboration,"60-80% of Tweeters posting on Russia-Ukraine war are bots, 90 ...",https://news.ycombinator.com/item?id=32866481,"Moreover, no amount of ""western"" propaganda will convince someone in a country that was hit by the USA or NATO bombs that Ukraine supported by ""the west"" is ... Page Type:  Published on: ",170,"neutral sentiment, score=0.6275859475135803"
7,Corroboration,On the removal of Come Back Alive | Hacker News,https://news.ycombinator.com/item?id=30465654,"Feb 25, 2022 ... Russia's invasion of Ukraine is morally wrong (and as a sibling comment pointed out, the invasion itself may be a war crime). Page Type:  Published on: ",140,"neutral sentiment, score=0.9379177689552307"
8,Corroboration,Imgur: The magic of the Internet,https://imgur.com/t/russia/time,"Imgur is the easiest way to discover and enjoy the magic of the Internet. It’s where you’ll find the funniest, most informative and inspiring images, memes, GIFs, and visual stories served up in an endless stream of bite-sized fun. Powered by a passionate community of people from all around the world, anyone can join to share cool stuff and vote the best to the top. You’ll always find something on Imgur to make you smile and brighten your day. Page Type: website Published on: ",130,"positive sentiment, score=0.5560187101364136"
9,Corroboration,Shalom Center MInistry,https://vimeo.com/channels/325917,"a  Verse 42 declares “Egypt shall not escape” this time. Then, verse 43 says, “the Libyans and the Ethiopians shall be at his steps.” The… Page Type: og_vimeo:channel Published on: ",130,"neutral sentiment, score=0.9283497333526611"
10,Corroboration,EXPLAINER: The story behind Ukraine's separatist regions,https://apnews.com/article/russia-ukraine-europe-russia-vladimir-putin-moscow-bcd0c04a2aa146e76b7e757f482f27bb,"MOSCOW (AP) — Russian President Vladimir Putin on Monday recognized the independence of Moscow-backed rebel regions in eastern Ukraine, a move that will further fuel tensions with the West amid fears of Russian invasion. Page Type: article Published on: 2022-02-21T17:59:56Z",120,"neutral sentiment, score=0.8988357186317444"
11,Corroboration,kremlin drone strike｜TikTok Search,https://www.tiktok.com/discover/kremlin-drone-strike,Discover videos related to kremlin drone strike on TikTok. Page Type: website Published on: ,120,"neutral sentiment, score=0.963115930557251"
12,Corroboration,drone hits kremlin｜TikTok Search,https://www.tiktok.com/discover/drone-hits-kremlin,Discover videos related to drone hits kremlin on TikTok. Page Type: website Published on: ,120,"neutral sentiment, score=0.9539896249771118"
13,Corroboration,lavrov photos on Flickr,https://www.flickr.com/photos/tags/lavrov/,"Flickr photos, groups, and tags related to the ""lavrov"" Flickr tag. Page Type:  Published on: ",120,"neutral sentiment, score=0.9573423266410828"
14,Corroboration,"Russia rejects $60-per-barrel cap on its oil, warns Western countries of cutoffs",https://www.pbs.org/newshour/world/russia-rejects-60-per-barrel-cap-on-its-oil-warns-western-countries-of-cutoffs,Russian authorities rejected a price cap on the country's oil set by Ukraine’s Western supporters and threatened Saturday to stop supplying the nations that endorsed it. Page Type: article Published on: 2022-12-03T11:28:33-04:00,110,"negative sentiment, score=0.7419066429138184"
15,Corroboration,Remarks by President Biden Ahead of the One-Year Anniversary of Russia's Brutal and Unprovoked Invasion of Ukraine | The White House,https://www.whitehouse.gov/briefing-room/speeches-remarks/2023/02/21/remarks-by-president-biden-ahead-of-the-one-year-anniversary-of-russias-brutal-and-unprovoked-invasion-of-ukraine/,"The Royal Castle in WarsawWarsaw, Poland 5:39 P.M. CET THE PRESIDENT:  Hello, Poland!  (Applause.)  One of our great allies.  President Duda, Prime Minister — Mr. Prime Minister, Mr. Mayor, and to all the former ministers and presidents, as well as mayors and Polish political leaders from all across the country: Thank you for welcoming me… Page Type: article Published on: 2023-02-21T19:19:05+00:00",100,"neutral sentiment, score=0.6790059208869934"
16,Corroboration,Russian diplomat trolls western｜TikTok Search,https://www.tiktok.com/discover/Russian-diplomat-trolls-western,Discover videos related to Russian diplomat trolls western on TikTok. Page Type: website Published on: ,100,"neutral sentiment, score=0.954805850982666"
17,Corroboration,"r/truegaming on Reddit: Atomic Heart, Russian game studios, and how we ought to treat them and their products given the ongoing Russian invasion of Ukraine.",https://www.reddit.com/r/truegaming/comments/10fl8xa/atomic_heart_russian_game_studios_and_how_we/,Posted by u/Wulfrinnan - 468 votes and 250 comments Page Type: website Published on: ,100,"neutral sentiment, score=0.7974538207054138"
18,Corroboration,hypodermic photos on Flickr,https://www.flickr.com/photos/tags/hypodermic/,"Flickr photos, groups, and tags related to the ""hypodermic"" Flickr tag. Page Type:  Published on: ",100,"neutral sentiment, score=0.9643924832344055"
19,Corroboration,Olena Semenyaka on the Ukrainian Crisis Part II for Guide to Kulchur podcast,https://www.tumblr.com/interregnum-intermarium/181741671994/olena-semenyaka-on-the-ukrainian-crisis-part-ii,"Olena Semenyaka, international secretary of National Corps, researcher of Conservative Revolution, Ernst Jünger’s legacy and his dialogue with Martin Heidegger on the prospects of a new metaphysics o… Page Type: video Published on: ",90,"neutral sentiment, score=0.9000293016433716"
20,Corroboration,Manufactured Crisis: CIA trained the Neo-Nazi Azov Battalion and has chosen Ukraine as birthplace of new “Global White Supremacist” Terror Threat,https://vk.com/@secretxgovernment-manufactured-crisis-cia-trained-the-neo-nazi-azov-battalion,", By Whitney Webb @ THE EXPOSÉ ( April 03, 2022 ) : Page Type: website Published on: ",90,"neutral sentiment, score=0.5848425626754761"
21,Corroboration,FACT SHEET: One Year of Supporting Ukraine | The White House,https://www.whitehouse.gov/briefing-room/statements-releases/2023/02/21/fact-sheet-one-year-of-supporting-ukraine/,"Nearly one year ago, Russia launched its unjust, brutal assault against Ukraine. Putin’s invasion was a test of Ukraine’s commitment to freedom, and a test for America and the world. Putin sought to subjugate Ukraine, but the free people of Ukraine stood strong—bravely defending their sovereignty and democracy. The United States, alongside our allies and partners,… Page Type: article Published on: 2023-02-21T15:06:17+00:00",80,"neutral sentiment, score=0.7642157673835754"
22,Corroboration,Has Putin's war failed and what does Russia want from Ukraine?,https://www.bbc.com/news/world-europe-56720589,"A year into Russia's war, he has little to show for it but there is no sign of an end. Page Type: article Published on: ",80,"negative sentiment, score=0.5756465792655945"
23,Corroboration,Russia Wants a Long War,https://www.foreignaffairs.com/united-states/russia-wants-long-war,"The West needs to send Ukraine more arms, more quickly. Page Type: Article Published on: 2023-03-16T00:00:00-04:00",80,"neutral sentiment, score=0.8448326587677002"
24,Corroboration,Kremlin says West is to blame for Ukraine grain crisis,https://www.reuters.com/world/europe/kremlin-says-west-is-blame-ukraine-grain-export-problems-2022-05-26/,"The Kremlin on Thursday said the West only had itself to blame for a brewing food crisis due to problems getting Ukraine's grain out to world markets, demanding the United States and its allies scrap what it cast as illegal sanctions. Page Type: article Published on: 2022-05-27T02:27:52Z",80,"negative sentiment, score=0.8537194728851318"
25,Corroboration,geopolitics photos on Flickr,https://www.flickr.com/photos/tags/geopolitics/,"Flickr photos, groups, and tags related to the ""geopolitics"" Flickr tag. Page Type:  Published on: ",80,"neutral sentiment, score=0.9547634720802307"
26,Corroboration,Imgur: The magic of the Internet,https://imgur.com/t/ukraine/time,"Imgur is the easiest way to discover and enjoy the magic of the Internet. It’s where you’ll find the funniest, most informative and inspiring images, memes, GIFs, and visual stories served up in an endless stream of bite-sized fun. Powered by a passionate community of people from all around the world, anyone can join to share cool stuff and vote the best to the top. You’ll always find something on Imgur to make you smile and brighten your day. Page Type: website Published on: ",80,"positive sentiment, score=0.5560187101364136"
27,Corroboration,Surviving the War: Russia-Western Balkan Ties After the Invasion of Ukraine,https://carnegieendowment.org/politika/89600,"Without the assistance of local actors, Russian influence in the Western Balkans would disappear overnight. But the opposite is also true. As long as local politicians can capitalize on invoking Moscow’s long shadow, Russia will remain a salient part of the Balkan landscape. Page Type: article Published on: ",80,"neutral sentiment, score=0.8736518621444702"
28,Corroboration,Ukraine crisis: Who are the Russia-backed separatists?,https://www.aljazeera.com/news/2022/2/4/ukraine-crisis-who-are-the-russia-backed-separatists,"About 4 million live in two pro-Russia statelets, including fighters who were born in Ukraine and Russian volunteers. Page Type: article Published on: ",70,"neutral sentiment, score=0.8030627369880676"
29,Corroboration,“There is no Ukraine”: Fact-Checking the Kremlin’s Version of Ukrainian History,https://blogs.lse.ac.uk/lseih/2020/07/01/there-is-no-ukraine-fact-checking-the-kremlins-version-of-ukrainian-history/,"The notion that Ukraine is not a country, but a historical part of Russia, appears to be deeply ingrained in the minds of Russian leadership. Competing interpretations of history have turned into a… Page Type: article Published on: 2020-07-01T16:05:35+00:00",70,"neutral sentiment, score=0.9091866612434387"
30,Corroboration,Kremlin tells 'deluded' West that tanks for Ukraine will change nothing,https://www.reuters.com/world/europe/kremlin-tells-deluded-west-that-tanks-ukraine-will-change-nothing-2023-01-20/,"The Kremlin said on Friday that Western countries supplying additional tanks to Ukraine would not change the course of the conflict and the West would regret its ""delusion"" that Ukraine could win on the battlefield. Page Type: article Published on: 2023-01-20T13:47:23Z",70,"negative sentiment, score=0.5041574239730835"
31,Corroboration,r/changemyview on Reddit: CMV: Ukraine should be allowed to attack targets inside Russia with donated Western equipment and weapons,https://www.reddit.com/r/changemyview/comments/132yyqu/cmv_ukraine_should_be_allowed_to_attack_targets/,Posted by u/TW1312 - 117 votes and 143 comments Page Type: website Published on: ,70,"neutral sentiment, score=0.8250504732131958"
32,Corroboration,Working Class Solidarity,https://www.tumblr.com/workersolidarity,A Marxist Leninist Blog. News and Communist Propaganda 🇨🇳🇰🇵🇨🇺🇻🇳🇱🇦 Page Type: profile Published on: ,70,"neutral sentiment, score=0.7982432842254639"
33,Corroboration,Ukraine Under Attack,https://www.flickr.com/photos/13476480@N07/51969350267,"Fierce fighting and constant shelling have become the norm in Kyiv and its surrounding areas. On the northern front lines, a Ukrainian soldier walked past a Russian vehicle destroyed in an earlier fire fight.Credit...Ivor Prickett for The New York Times  www-nytimes-com.translate.goog/live/2022/03/29/world/ukra...  --------------------  March 29, 2022 March 29, 2022  Dan Bilefsky and Andrew E. Kramer In Kyiv, battleground for a nation’s soul, Ukraine tries to put Russia on the defensive.  After Russia’s invasion, Kyiv became a battleground for the soul of Ukraine.  In only five weeks one of Europe’s most lively capitals has become a place where residential apartment buildings can crumble under strikes at a moment’s notice, where street-by-street gunfights have raged in northwestern suburbs and where women are forced to give birth in underground makeshift shelters.  Now, comments by Russia’s deputy defense minister on Tuesday that Russia would sharply “reduce military activity” near Kyiv amid fra Page Type: article Published on: ",70,"neutral sentiment, score=0.5468081831932068"
34,Corroboration,VICE News on TikTok,https://www.tiktok.com/@vicenews/video/7214184567303900421,"South Africa is officially obliged to arrest Vladimir Putin after the International Criminal Court issued an arrest warrant for him, and the Russian president is due to visit in August... #southafrica #southafricatiktok #vladimirputin #putin #russia #arrestwarrant #internationalcriminalcourt #ukrainewarrussia #ukrainewar #warrant Page Type: website Published on: ",60,"neutral sentiment, score=0.9628340601921082"
35,Corroboration,The Azov Movement in the West: achievements in 2019,https://www.tumblr.com/interregnum-intermarium/184469943719/the-azov-movement-in-the-west-achievements-in,"Despite the fact that the official agenda of National Corps is a course towards Intermarium (Adriatic-Baltic-Black Sea Union), the years 2018 and 2019 were marked not only by regional events of the I… Page Type: article Published on: ",60,"positive sentiment, score=0.583296537399292"
36,Corroboration,NATO's response to Russia's invasion of Ukraine,https://www.nato.int/cps/en/natohq/topics_192648.htm,"NATO condemns in the strongest possible terms Russia's brutal and unprovoked war of aggression against Ukraine - which is an independent, peaceful and democratic country, and a close NATO partner. NATO and Allies continue to provide Ukraine with unprecedented levels of support, helping to uphold its fundamental right to self-defence. Page Type: website Published on: ",60,"neutral sentiment, score=0.8744595050811768"
37,Corroboration,"Burn Magazine on Instagram: ""“Beware the Ides of March” 
𝘑𝘶𝘭𝘪𝘶𝘴 𝘊𝘢𝘦𝘴𝘢𝘳.

Photographs and text by Jérôme Sessini (@jeromesessini). 

In 2014 until 2017, I worked in the Russian-speaking regions of Donbass, in Donetsk, Luhansk, Mariupol… Russia was clearly supporting the pro-Russian separatists, and the Russian media was showering Russian-speaking civilians with propaganda against the Ukrainian government and against the Western media, but still, the Russian-speaking civilians were paying with their lives. I photographed the civilian victims of Ukrainian army artillery. I was guided by this feeling of revolt and injustice that I know too well, each time common people are killed, injured, torn apart, by wars that are beyond them… 

Every time I was coming back to Kyiv from the Donbass war zone, my Ukrainian friends asked me questions tinged with reproaches:
-“Why are you going to photograph these crazy people? (Russian-speaking Ukrainians), they want to be R",https://www.instagram.com/p/Ch-NARTO3UQ/,"1,577 likes, 22 comments - Burn Magazine (@burnmagazine) on Instagram: ""“Beware the Ides of March” 
𝘑𝘶𝘭𝘪𝘶𝘴 𝘊𝘢𝘦𝘴𝘢𝘳.

Photographs a..."" Page Type: instapp:photo Published on: ",50,"negative sentiment, score=0.7403272986412048"
38,Corroboration,r/changemyview on Reddit: CMV: Ukraine is winning the war now and they’d be stupid to try and make a deal with russia at this point,https://www.reddit.com/r/changemyview/comments/yb8xyk/cmv_ukraine_is_winning_the_war_now_and_theyd_be/,Posted by u/prodlaps - 644 votes and 476 comments Page Type: website Published on: ,50,"negative sentiment, score=0.7525872588157654"
39,Corroboration,"r/UkrainianConflict on Reddit: Kremlin acknowledges waging ‘difficult’ campaign in Ukraine - “It was hard to imagine that NATO members, the US, EU, would first indirectly and then directly intervene in the conflict. Russia is too big a country to be treated like this, and Russia is too strong a country to surrender.”",https://www.reddit.com/r/UkrainianConflict/comments/13iljib/kremlin_acknowledges_waging_difficult_campaign_in/,"Posted by u/Prunestand - 1,222 votes and 351 comments Page Type: website Published on: ",50,"negative sentiment, score=0.719035267829895"
40,Corroboration,Black Swan Europa redux,https://www.tumblr.com/blackswaneuroparedux/678158293862154240/never-fight-with-russians-on-your-every-stratagem,"Never fight with Russians. On your every stratagem they answer with unpredictable stupidity.

- Otto von Bismarck Page Type: article Published on: ",50,"neutral sentiment, score=0.9541299939155579"
41,Corroboration,"After Ukraine, Is Kazakhstan Next in the Kremlin’s Sights?",https://carnegieendowment.org/politika/87652,"A social media post by former Russian president Dmitry Medvedev warning that northern Kazakhstan could be next in line after Ukraine was quickly taken down, but it reflects the mindset of Russian hawks and is entirely in keeping with Russian political dialogue, where few taboos remain. Page Type: article Published on: ",50,"neutral sentiment, score=0.9582405090332031"
42,Corroboration,Crimea: Six years after illegal annexation,https://www.brookings.edu/blog/order-from-chaos/2020/03/17/crimea-six-years-after-illegal-annexation/,"Six years after Russia illegally annexed Crimea, Ukraine lacks the leverage to restore sovereignty over the region, but the West should not accept it since doing so would only encourage Russia to believe it can get away with annexing territory from other countries. Page Type: article Published on: 2020-03-17T15:28:06+00:00",40,"neutral sentiment, score=0.7602246403694153"
43,Corroboration,"Financial Times on Instagram: ""You probably don't think of the war in Ukraine when you think of things that might affect the diamond industry, but this could soon change. ⁠
⁠
This month, officials from the world’s seven largest advanced economies, a group known as the G7, are expected to vow to work towards measures that make it harder to sell Russian diamonds in their nations, in a bid to squeeze Moscow’s access to finance, and — they hope — impede the Kremlin’s ability to wage war on Ukraine.⁠
⁠
Any changes the G7 makes would not just affect Russia though. It could also strangle the wider diamond industry, say those who work in it. There's anxiety about how a lasting, unwieldy effort to throttle a relatively minor cash stream for Russia (rough diamond exports are only a fraction of crude oil exports) would threaten their livelihoods.⁠
⁠
India is particularly at risk. It boasts more than 90% of the world’s diamond manufacturing, and Surat on the north-west coast is the industry’s ca",https://www.instagram.com/p/CsOURVst2dp/,"May 14, 2023 - 12K likes, 307 comments - Financial Times (@financialtimes) on Instagram: ""You probably don't think of the war in Ukraine when you think of things that might affect the dia..."" Page Type: instapp:photo Published on: ",40,"negative sentiment, score=0.7394763827323914"
44,Corroboration,"r/changemyview on Reddit: CMV: Putin is a maniac, and his war in Ukraine is a human-rights atrocity that has ZERO justification for happening.",https://www.reddit.com/r/changemyview/comments/ydb11h/cmv_putin_is_a_maniac_and_his_war_in_ukraine_is_a/,Posted by u/TyGuyy - 139 votes and 348 comments Page Type: website Published on: ,40,"negative sentiment, score=0.8037000298500061"
45,Corroboration,r/changemyview on Reddit: CMV: There is no realistic path to pushing the Russian military out of Ukraine,https://www.reddit.com/r/changemyview/comments/122kz8s/cmv_there_is_no_realistic_path_to_pushing_the/,Posted by u/iwanttobepart - 23 votes and 97 comments Page Type: website Published on: ,40,"negative sentiment, score=0.5494853258132935"
46,Corroboration,Closed McDonalds in front of the Kremlin,https://www.flickr.com/photos/jlascar/19778319879,"PRINT A A A Russia's consumer watchdog has ordered the closure of four McDonald's restaurants in Moscow citing ""numerous violations"" of the country's sanitary laws.  Watchdog Rospotrebnadzor said branches on Pushkin Square, the first McDonald's opened in Russia in 1990, Manezh Square and Prospect Mira in central Moscow would be temporarily shut as part of an ongoing investigation into the chain's food standards.  Several politicians, including the nationalist Vladimir Zhirinovsky, have criticised the chain and called for the country to close all McDonald's outlets in Russia after the burger chain announced it would close its branches in the Crimean peninsula in April.  The closures come against a backdrop of worsening US-Russian ties over the crisis in Ukraine. Earlier this month, the Kremlin banned food imports from the West in retaliation over Russia's alleged involvement with separatists suspected of shooting down a passenger plane flying over rebel territory on 17 July. Page Type: article Published on: ",40,"neutral sentiment, score=0.8846806287765503"
47,Corroboration,Thompson Releases Statement on One Year of Putin's Full-Scale Illegal Invasion of Ukraine,http://mikethompson.house.gov/newsroom/press-releases/thompson-releases-statement-one-year-putins-full-scale-illegal-invasion,"Today, Rep. Mike Thompson (CA-04) released the following statement in recognition of the one-year mark of the Russian invasion of Ukraine. Page Type: article Published on: 2023-02-24T11:31:29-05:00",30,"neutral sentiment, score=0.8068760633468628"
48,Corroboration,"The Logical Indian on Instagram: ""#UkraineRussiaWar - #Russia is reportedly planning to disconnect itself from Western internet services as technology companies block off the country during the invasion of Ukraine.

The #Kremlin has been trying to eliminate any reliance on Western internet services, possibly isolating Russia from the rest of the global Internet. 

The move could isolate Russia further as firms including Netflix, Adobe, PayPal, and others suspended services.

According to new documents released by the Russian Ministry of Digital Development, some governments have suggested that the Kremlin has probably begun planning to disconnect from the global Internet by March 11, reported News18. 

The Russian Ministry stated, ""There are continuous cyber-attacks on Russian sites abroad. We are preparing for different scenarios, and there are no plans to disconnect the Internet from inside.""

However, the newly released documents also instruct websites to use Russian Domain Name System (DNS) servers by Mar",https://www.instagram.com/p/Ca87O5jputF/,"2,444 likes, 5 comments - The Logical Indian (@thelogicalindian) on Instagram: ""#UkraineRussiaWar - #Russia is reportedly planning to disconnect itself from Western internet ser..."" Page Type: instapp:photo Published on: ",30,"neutral sentiment, score=0.4688407778739929"
49,Corroboration,Ukraine.ua (@ukraine.ua) • Instagram photos and videos,https://www.instagram.com/ukraine.ua/,"1M Followers, 332 Following, 2,309 Posts - See Instagram photos and videos from Ukraine.ua (@ukraine.ua) Page Type: profile Published on: ",30,"neutral sentiment, score=0.9515155553817749"
